{
  "source_id": "SRC-NEPAL-POLICE-UDB-FOUND-0001",
  "publisher": "Nepal Police - Crime Investigation Department",
  "authority_type": "police_primary",
  "url": "https://udb.nepalpolice.gov.np/found",
  "publication_date": null,
  "retrieved_at": "2026-08-29",
  "source_tier": 1,
  "language": "ne",
  "notes": "Found/stranded-person dataset is separate from missing-person data and must be reconciled independently."
}
