{
  "source_id": "SRC-FAMILY-0001",
  "publisher": "Family/community public appeal",
  "authority_type": "family_first_hand",
  "url": "UNRESOLVED-PUBLIC-APPEAL-URL",
  "publication_date": null,
  "retrieved_at": "2026-08-29",
  "source_tier": 4,
  "language": "ne",
  "archived_copy": null,
  "hash": null,
  "notes": "Original family appeal previously reviewed. Contact details are retained in investigator evidence but should not be exposed in public output by default."
}
