{
  "source_id": "SRC-DAO-MAKWANPUR-0001",
  "publisher": "District Administration Office Makwanpur",
  "authority_type": "district_administration",
  "url": "https://daomakawanpur.moha.gov.np/post/rasa-va-ghatana-ma-sama-para-ka-va-ha-na-bhaeka-makava-napa-ra-ja-l-l-ka-va-yaka-2",
  "publication_date": "2083-05-12",
  "retrieved_at": "2026-08-29",
  "source_tier": 1,
  "language": "ne",
  "archived_copy": null,
  "hash": null,
  "notes": "Official Makwanpur list of persons out of contact in the Rasuwa incident. Two same-title publications/files exist and require full version diffing."
}
