{
  "source_id": "SRC-NEPAL-POLICE-UDB-MISSING-0001",
  "publisher": "Nepal Police - Crime Investigation Department",
  "authority_type": "police_primary",
  "url": "https://udb.nepalpolice.gov.np/missing",
  "publication_date": null,
  "retrieved_at": "2026-08-29",
  "source_tier": 1,
  "language": "ne",
  "notes": "Current missing-person database contains multiple Rasuwa flood records with disappearance date 2026-08-26. Search-index visibility is incomplete and must not be treated as proof of absence."
}
